"chapter","verse","text"
"1","2",""Let him kiss me with the kisses of his mouth: for thy love is better than wine.""
"1","8",""If thou know not, O thou fairest among women, go thy way forth by the footsteps of the flock, and feed thy kids beside the shepherds' tents.""
"2","4",""He brought me to the banqueting house, and his banner over me was love."""
"2","14",""O my dove, that art in the clefts of the rock, in the secret places of the stairs, let me see thy countenance, let me hear thy voice; for sweet is thy voice, and thy countenance is comely."""
"4","7",""Thou art all fair, my love; there is no spot in thee."""
"8","7",""Many waters cannot quench love, neither can the floods drown it: if a man would give all the substance of his house for love, it would utterly be contemned.""