"chapter","verse","text"
"1","3","Blessed be the God and Father of our Lord Jesus Christ, who hath blessed us with all spiritual blessings in heavenly places in Christ:"
"2","20","I am crucified with Christ: nevertheless I live; yet not I, but Christ liveth in me: and the life which I now live in the flesh I live by the faith of the Son of God, who loved me, and gave himself for me."
"3","22","But the scripture hath concluded all under sin, that the promise by faith of Jesus Christ might be given to them that believe."
"3","28","There is neither Jew nor Greek, there is neither bond nor free, there is neither male nor female: for ye are all one in Christ Jesus."
"4","7","Wherefore thou art no more a servant, but a son; and if a son, then an heir of God through Christ."
"5","22","But the fruit of the Spirit is love, joy, peace, longsuffering, gentleness, goodness, faith,"
"5","25","If we live in the Spirit, let us also walk in the Spirit."
"6","7","Be not deceived; God is not mocked: for whatsoever a man soweth, that shall he also reap."
"6","9","And let us not be weary in well doing: for in due season we shall reap, if we faint not."