1,1,"That which was from the beginning, which we have heard, which we have seen with our eyes, which we have looked upon, and our hands have handled, of the Word of life;"
1,9,"If we confess our sins, he is faithful and just to forgive us our sins, and to cleanse us from all unrighteousness."
2,9,"He that saith he is in the light, and hateth his brother, is in darkness even until now."
2,22,"Who is a liar but he that denieth that Jesus is the Christ? He is antichrist, that denieth the Father and the Son."
3,13,"Marvel not, my brethren, if the world hate you."
3,18,"My little children, let us not love in word, neither in tongue; but in deed and in truth."
4,4,"Ye are of God, little children, and have overcome them: because greater is he that is in you, than he that is in the world."
4,19,"We love him, because he first loved us."
5,13,"These things have I written unto you that believe on the name of the Son of God; that ye may know that ye have eternal life, and that ye may believe on the name of the Son of God."